{
 "schema": 1,
 "writer": "evening-cloud",
 "at": "2026-10-16T14:00:00Z",
 "source": "evening 8:15",
 "snapshot": {
  "date": "2026-10-16",
  "generatedAt": "2026-10-16T14:00:00.000Z",
  "specVersion": null,
  "release": "v4.0.0",
  "derivedHash": "3e4bdc2c5f514755ec2f91b790642ac95ffe62fad422a5bde541475ad77890ca",
  "nextExams": [
   {
    "id": "E9",
    "title": "Sample Exam 9",
    "date": "2026-11-20",
    "course": "NUR 112",
    "kind": "unit",
    "daysLeft": 35
   }
  ],
  "due": {
   "count": 0,
   "top": []
  },
  "weakspots": {
   "active": 1,
   "solid": 0,
   "notes": 0,
   "byExam": {
    "E9": {
     "active": 1,
     "solid": 0,
     "parked": 0,
     "need": 2,
     "preRead": 0
    }
   }
  },
  "today": {
   "dayType": "class",
   "push": "Class day · 2 reviews ready · New on Canvas: Sample announcement",
   "reviewSet": "review-2026-10-16",
   "reviewItems": 2,
   "answered": 0
  },
  "reading": [],
  "canvas": null,
  "health": {
   "runs": {
    "morning": {
     "id": "morning-20261016-092500-ab12",
     "status": "ok",
     "startedAt": "2026-10-16T09:25:00Z",
     "endedAt": "2026-10-16T09:31:00Z",
     "detail": "",
     "release": "v4.0.0"
    }
   },
   "capacity": {
    "docs": 30,
    "level": "ok",
    "budgets": [
     {
      "collection": "answers",
      "docs": 1,
      "bytes": null,
      "warnDocs": 400,
      "failDocs": null,
      "warnBytes": null,
      "failBytes": null,
      "level": "ok",
      "relief": "weekly answer statistics per week (weeks/<date> roll-up)"
     },
     {
      "collection": "materials",
      "docs": 1,
      "bytes": 271,
      "warnDocs": null,
      "failDocs": null,
      "warnBytes": 4194304,
      "failBytes": null,
      "level": "ok",
      "relief": "the lazy library load (the page loads a course's materials when the library is opened); chunked as materials/<id>-p2 past the text cap"
     },
     {
      "collection": "runs",
      "docs": 2,
      "bytes": null,
      "warnDocs": 1500,
      "failDocs": null,
      "warnBytes": null,
      "failBytes": null,
      "level": "ok",
      "relief": "weekly run counts per pipeline (weeks/<date> roll-up); pulls page by cursor"
     },
     {
      "collection": "sets",
      "docs": 1,
      "bytes": null,
      "warnDocs": 400,
      "failDocs": null,
      "warnBytes": null,
      "failBytes": null,
      "level": "ok",
      "relief": "the weekly roll-up (weeks/<date>) in place of reading every set"
     },
     {
      "collection": "state",
      "docs": 0,
      "bytes": null,
      "warnDocs": null,
      "failDocs": null,
      "warnBytes": 196608,
      "failBytes": 245760,
      "level": "ok",
      "relief": "factHashes split per collection into state/facts-<collection> (the state step does it when state/current reaches warnBytes)"
     }
    ]
   },
   "counts": {
    "announcements": 1,
    "answers": 1,
    "concepts": 1,
    "dateedits": 1,
    "dates": 1,
    "dayedits": 1,
    "days": 1,
    "examedits": 1,
    "exams": 3,
    "health": 1,
    "ideas": 1,
    "jobresults": 1,
    "jobs": 1,
    "legacy": 1,
    "materialedits": 1,
    "materials": 1,
    "objectives": 1,
    "planedits": 1,
    "plans": 1,
    "predictions": 1,
    "runs": 2,
    "sessions": 1,
    "sets": 1,
    "talk": 2,
    "weakspots": 1,
    "weeks": 1
   }
  },
  "lint": {
   "errors": 0,
   "warnings": 0,
   "top": [
    {
     "severity": "info",
     "code": "exam-passed",
     "ref": "exams/E8",
     "msg": "exam date passed; record the score to calibrate"
    }
   ]
  }
 },
 "derivedHash": "3e4bdc2c5f514755ec2f91b790642ac95ffe62fad422a5bde541475ad77890ca",
 "factHashes": {
  "announcements/canvas-900003": "641770b9b1d7e3bdfe6c1fb57570843b8bf540467578b13eb0b2f2f2c62ffa88.5b",
  "answers/review-2026-10-16": "0c24a0dedcbc763cc51de3c6b7011e48ca5815a2f34de25e7fc8f81906aac8c4.f",
  "dates/canvas-900001": "c1f10c8dd336167913dbeab1e3047412d8a242e23ee52d59367b4cb4fba53820.1iy",
  "exams/E7": "cc024f3f54008519ddea6f49f4f5c947bbff48b5ae029b9aa53615e9d2cd8738.dz",
  "exams/E8": "1172ef5cce633e4f2ac25173cdb797fc05e209a73324e44f4339820adf459fcd.dz",
  "exams/E9": "e30f6b408232328d5f24450b33b0434297717ca133a1cf12d87b8e49b67342dc.dz",
  "ideas/sample-idea": "8963ef5404bca14ba002ef1b5d2d9a8a28095629dc8a8a5c632ac81a444afb4e.53",
  "jobs/job-20261016-140000-sample-guide": "388e38c82f06a82881d092bb99f396aa41b8e70db8fe0a0b228882d3b9301495.1r",
  "legacy/reviews-sample": "4b11eee09544b4f30670eca939f35e5cebd72d7a3af2dbd11465013a530ac93a.1",
  "materials/NUR112-900002": "794117a2bfcd884a4ddb8502a262a6d6d40bc3b40364e8545f7f2d1023030964.1pfa",
  "objectives/E9-1": "5df46bdb96da5ced69f7d4847254b251e308c3a72ed8aa994a128979a18fe1f8.3j",
  "plans/E9": "821421d879d2ff8aba67dca68afb0354b4be00ca9373cb63843c265af731c92e.bi",
  "sessions/ss-20261016-200000-sample-note": "6fe2843edc1711f6e38acdc71e60afd99e328073d2747ce337c61ff21aa2f089.1orv6",
  "sets/review-2026-10-16": "752872e9d9208a7d5f38dd6d201f2d286e5cb81d099153b7fce80925c8a5c137.27q",
  "talk/2026-10-16": "c549ca5d6ad0e07400013603e572c06aba43e6622d1e79215bb781491ffa078b.f",
  "weakspots/ws-2026-10-16-E9-1-sample-topic": "caa1e436f384c33a5b2c48d4a5e1f46b5ec603c443ce8f1ff4a2ac11886c2e09.5z2"
 },
 "factFields": {
  "announcements": [
   "course",
   "postedAt",
   "schema",
   "source",
   "text",
   "title",
   "url",
   "writer"
  ],
  "answers": [
   "schema",
   "setId",
   "source",
   "writer"
  ],
  "dates": [
   "addedBy",
   "canvasId",
   "canvasType",
   "course",
   "graded",
   "kind",
   "notes",
   "schema",
   "source",
   "title",
   "writer"
  ],
  "exams": [
   "course",
   "date",
   "kind",
   "planId",
   "schema",
   "source",
   "status",
   "title",
   "writer"
  ],
  "ideas": [
   "links",
   "objective",
   "schema",
   "sessionId",
   "source",
   "text",
   "weakspotId",
   "writer"
  ],
  "jobs": [
   "brief",
   "kind",
   "schema",
   "source",
   "title",
   "writer"
  ],
  "legacy": [
   "migratedTo"
  ],
  "materials": [
   "addedBy",
   "chars",
   "course",
   "exam",
   "fileId",
   "fileType",
   "kind",
   "module",
   "ocr",
   "pages",
   "schema",
   "section",
   "source",
   "title",
   "unit",
   "url",
   "writer"
  ],
  "objectives": [
   "chapters",
   "exam",
   "num",
   "schema",
   "source",
   "text",
   "writer"
  ],
  "plans": [
   "cards",
   "days",
   "exam",
   "schema",
   "source",
   "sourceUrl",
   "tasks",
   "title",
   "writer"
  ],
  "sessions": [
   "cardCount",
   "cards",
   "checks",
   "connections",
   "date",
   "driver",
   "endedBy",
   "filedAt",
   "folder",
   "kind",
   "minutes",
   "noteId",
   "noteTodos",
   "questions",
   "schema",
   "skill",
   "source",
   "startedAt",
   "summary",
   "topic",
   "weakSpots",
   "writer"
  ],
  "sets": [
   "createdAt",
   "date",
   "exam",
   "focus",
   "items",
   "kind",
   "objectives",
   "planTaskId",
   "schema",
   "source",
   "title",
   "writer"
  ],
  "talk": [
   "date",
   "schema",
   "source",
   "writer"
  ],
  "weakspots": [
   "addedBy",
   "course",
   "exam",
   "initial",
   "kind",
   "objective",
   "origin",
   "preRead",
   "readingDue",
   "schema",
   "source",
   "topic",
   "writer"
  ]
 }
}